term,fdr,Odds Ratio,Combined Score,Genes,description
GO:0016052,0.006340344,9.864139,126.0237,PFKFB2;PFKFB1;MANBA;PKLR;HKDC1;NEU1;ENO2;ENO3;GAPDH,Carbohydrate Catabolic Process (GO:0016052)
GO:0048247,0.009555099,36.2341,422.9482,SLC12A2;HSD3B7;CCL20;CCL2;GAS6,Lymphocyte Chemotaxis (GO:0048247)
GO:0006096,0.023344,10.18312,105.6389,PFKFB2;PFKFB1;PKLR;HKDC1;ENO2;ENO3;GAPDH,Glycolytic Process (GO:0006096)
GO:0046348,0.03022954,43.37563,426.2855,GNPDA1;GNPDA2;AMDHD2;RENBP,Amino Sugar Catabolic Process (GO:0046348)
GO:0006044,0.105069,21.68274,181.2422,GNPDA1;GNPDA2;OGA;RENBP,N-acetylglucosamine Metabolic Process (GO:0006044)
GO:0043410,0.1083242,3.11875,25.37801,BCAR3;ARHGAP8;FLT1;KSR1;CCL20;INAVA;TIRAP;MFHAS1;DSTYK;PDGFD;CCL2;PTK2B;GAS6;FGFR2;GSDME,Positive Regulation Of MAPK Cascade (GO:0043410)
GO:2000310,0.1083242,64.90633,518.721,CCL2;PTK2B;CAPN1,Regulation Of NMDA Receptor Activity (GO:2000310)
GO:0070374,0.1173778,4.130519,32.12734,MFHAS1;DSTYK;ARHGAP8;CCL20;PDGFD;CCL2;PTK2B;GAS6;FGFR2;TIRAP,Positive Regulation Of ERK1 And ERK2 Cascade (GO:0070374)
GO:0006090,0.1545427,5.649332,41.72136,PFKFB2;PFKFB1;PKLR;HKDC1;ENO2;ENO3;GAPDH,Pyruvate Metabolic Process (GO:0006090)
GO:0019262,0.166638,32.44937,230.6877,GNPDA1;GNPDA2;RENBP,N-acetylneuraminate Catabolic Process (GO:0019262)
GO:0030007,0.166638,32.44937,230.6877,SLC12A2;ATP1A4;ATP1B1,Intracellular Potassium Ion Homeostasis (GO:0030007)
GO:0098659,0.1796726,7.236641,46.98726,SLC12A2;CACNA2D1;ATP1A4;ATP2B4;ATP1B1,Inorganic Cation Import Across Plasma Membrane (GO:0098659)
GO:0055078,0.1796726,21.63038,139.5062,SLC12A2;ATP1A4;ATP1B1,Sodium Ion Homeostasis (GO:0055078)
GO:0006883,0.1796726,21.63038,139.5062,SLC12A2;ATP1A4;ATP1B1,Intracellular Sodium Ion Homeostasis (GO:0006883)
GO:0002548,0.1796726,21.63038,139.5062,FLT1;CCL20;CCL2,Monocyte Chemotaxis (GO:0002548)
GO:0043271,0.1796726,21.63038,139.5062,PXK;WNK4;PTK2B,Negative Regulation Of Monoatomic Ion Transport (GO:0043271)
GO:0007218,0.1796726,21.63038,139.5062,SORT1;CPE;SORL1,Neuropeptide Signaling Pathway (GO:0007218)
GO:0043069,0.1796726,2.179475,13.89222,TFAP2A;XBP1;GPX4;PRKDC;ANXA4;PAX2;MALT1;AQP1;PTMS;DSTYK;CCND2;MIEN1;TCIM;PDPN;CTSH;PTK2B;VHL;GAS6;CRYAB;HTATIP2;SNCA,Negative Regulation Of Programmed Cell Death (GO:0043069)
GO:0035754,0.1796726,inf,inf,HSD3B7;GAS6,B Cell Chemotaxis (GO:0035754)
GO:0010919,0.1796726,inf,inf,PTK2B;SNCA,Regulation Of Inositol Phosphate Biosynthetic Process (GO:0010919)
GO:0086100,0.1796726,inf,inf,BCAR3;PTK2B,Endothelin Receptor Signaling Pathway (GO:0086100)
GO:2000698,0.1796726,inf,inf,PROM1;PAX2,Positive Regulation Of Epithelial Cell Differentiation Involved In Kidney Development (GO:2000698)
GO:0051968,0.1796726,inf,inf,CCL2;PTK2B,"Positive Regulation Of Synaptic Transmission, Glutamatergic (GO:0051968)"
GO:0048667,0.1796726,4.482549,27.89594,OPHN1;TBCD;MAP6;ANK3;APBB1;PAX2;FGFR2,Cell Morphogenesis Involved In Neuron Differentiation (GO:0048667)
GO:0046395,0.1796726,9.631134,59.83695,GNPDA1;GNPDA2;AMDHD2;RENBP,Carboxylic Acid Catabolic Process (GO:0046395)
GO:0043087,0.1896817,2.66343,15.90783,BCAR3;CCL20;RASGRF2;OCRL;ARAP1;GMIP;RGP1;FGD4;FLCN;ALS2;PLXNA2;CCL2;AGRN,Regulation Of GTPase Activity (GO:0043087)
GO:0070372,0.1896817,2.795612,16.69637,DUSP4;MFHAS1;FLCN;DSTYK;ARHGAP8;CCL20;PDGFD;CCL2;PTK2B;GAS6;FGFR2;TIRAP,Regulation Of ERK1 And ERK2 Cascade (GO:0070372)
GO:0045785,0.1896817,4.232523,25.13948,MAGI1;FLCN;TMEM102;CCDC80;LAMB2;STX3;PLPP3,Positive Regulation Of Cell Adhesion (GO:0045785)
GO:0006048,0.1896817,16.22089,96.0827,GNPDA1;GNPDA2;UAP1L1,UDP-N-acetylglucosamine Biosynthetic Process (GO:0006048)
GO:0042471,0.1896817,16.22089,96.0827,TFAP2A;PAX2;FGFR2,Ear Morphogenesis (GO:0042471)
GO:0042472,0.1896817,16.22089,96.0827,TFAP2A;PAX2;FGFR2,Inner Ear Morphogenesis (GO:0042472)
GO:0009226,0.1896817,8.667005,51.23756,UGDH;GNPDA1;GNPDA2;UAP1L1,Nucleotide-Sugar Biosynthetic Process (GO:0009226)
GO:0043408,0.2487562,2.796437,15.62328,DUSP4;BCAR3;FLT1;KSR1;PIK3R2;DUSP16;WDR54;INAVA;FGFR2;TIRAP;GSDME,Regulation Of MAPK Cascade (GO:0043408)
GO:0043066,0.2487562,1.982675,11.00902,TFAP2A;XBP1;GRN;PRKDC;ANXA4;PAX2;MALT1;AQP1;PTMS;DSTYK;CCND2;MIEN1;TCIM;PDPN;CCL2;CTSH;PTK2B;VHL;GAS6;CRYAB;SNCA;HTATIP2,Negative Regulation Of Apoptotic Process (GO:0043066)
GO:0006047,0.2487562,12.97519,71.19194,GNPDA1;GNPDA2;UAP1L1,UDP-N-acetylglucosamine Metabolic Process (GO:0006047)
GO:0046349,0.2487562,12.97519,71.19194,GNPDA1;GNPDA2;UAP1L1,Amino Sugar Biosynthetic Process (GO:0046349)
GO:1905562,0.2487562,12.97519,71.19194,FLT1;AKT3;CCL2,Regulation Of Vascular Endothelial Cell Proliferation (GO:1905562)
GO:0051693,0.2487562,7.220812,38.88113,VIL1;SVIL;AVIL;ADD2,Actin Filament Capping (GO:0051693)
GO:0051016,0.2487562,7.220812,38.88113,VIL1;SVIL;AVIL;ADD2,Barbed-End Actin Filament Capping (GO:0051016)
GO:1990869,0.2487562,7.220812,38.88113,SLC12A2;CCL20;CCL2;PTK2B,Cellular Response To Chemokine (GO:1990869)
GO:0006814,0.2487562,7.220812,38.88113,SLC12A2;ATP1A4;WNK4;ATP1B1,Sodium Ion Transport (GO:0006814)
GO:0071248,0.2487562,3.62532,18.80643,TFAP2A;SLC12A2;CAMK2D;CDKN1B;ANK3;AQP1;SNCA,Cellular Response To Metal Ion (GO:0071248)
GO:0060441,0.2487562,43.16162,222.652,CTSH;FGFR2,Epithelial Tube Branching Involved In Lung Morphogenesis (GO:0060441)
GO:0032387,0.2487562,43.16162,222.652,ARHGAP8;CRYAB,Negative Regulation Of Intracellular Transport (GO:0032387)
GO:2000318,0.2487562,43.16162,222.652,TYK2;MALT1,Positive Regulation Of T-helper 17 Type Immune Response (GO:2000318)
GO:0051056,0.2487562,2.973008,15.30308,ARHGAP22;AKAP13;FLCN;FGD4;ARHGAP8;RASGRF2;ARAP1;RHOF;GMIP,Regulation Of Small GTPase Mediated Signal Transduction (GO:0051056)
GO:2001135,0.2487562,10.81139,55.29613,ARHGAP8;OCRL;SORL1,Regulation Of Endocytic Recycling (GO:2001135)
GO:0006054,0.2487562,10.81139,55.29613,GNPDA1;GNPDA2;RENBP,N-acetylneuraminate Metabolic Process (GO:0006054)
GO:0043266,0.2487562,10.81139,55.29613,PTK2B;ANK3;KCNAB2,Regulation Of Potassium Ion Transport (GO:0043266)
GO:0010518,0.2487562,10.81139,55.29613,FLT1;ESR1;FGFR2,Positive Regulation Of Phospholipase Activity (GO:0010518)
GO:0055075,0.2487562,10.81139,55.29613,SLC12A2;ATP1A4;ATP1B1,Potassium Ion Homeostasis (GO:0055075)
GO:1990573,0.2487562,10.81139,55.29613,SLC12A2;ATP1A4;ATP1B1,Potassium Ion Import Across Plasma Membrane (GO:1990573)
GO:1903522,0.2487562,10.81139,55.29613,ACE2;CAMK2D;S100A1,Regulation Of Blood Circulation (GO:1903522)
GO:1903169,0.2487562,10.81139,55.29613,CAMK2D;CACNA2D1;PTK2B,Regulation Of Calcium Ion Transmembrane Transport (GO:1903169)
GO:0007605,0.2487562,4.930025,25.13856,TFAP2A;MARVELD2;MYO7B;CCDC50;GSDME,Sensory Perception Of Sound (GO:0007605)
GO:0007015,0.2590319,2.727771,13.74954,VIL1;ENAH;MAD2L2;SVIL;AVIL;MYO5C;MYO7B;ELMO3;RHOF;PLS1,Actin Filament Organization (GO:0007015)
GO:0048812,0.2718196,2.884886,14.35141,IMPACT;NRN1;ALS2;FLRT3;MAP6;ANK3;APBB1;FGFR2;PAX2,Neuron Projection Morphogenesis (GO:0048812)
GO:0050954,0.2769016,4.715123,23.28693,TFAP2A;MARVELD2;MYO7B;CCDC50;GSDME,Sensory Perception Of Mechanical Stimulus (GO:0050954)
GO:0051345,0.3087713,2.628245,12.64906,BCAR3;RGP1;FLCN;ALS2;CCL20;RASGRF2;CTSH;CCL2;ARAP1;AGRN,Positive Regulation Of Hydrolase Activity (GO:0051345)
GO:0001678,0.3118857,4.51813,21.62331,XBP1;HKDC1;PIK3R2;GAS6;PAX2,Intracellular Glucose Homeostasis (GO:0001678)
GO:1904029,0.3428017,4.336896,20.12275,CDKN2B;CCNT2;CDKN1B;CCND2;CCND1,Regulation Of Cyclin-Dependent Protein Kinase Activity (GO:1904029)
GO:0071346,0.3428017,5.413071,24.60813,CCL20;CCL2;TYK2;GAPDH,Cellular Response To Type II Interferon (GO:0071346)
GO:1901216,0.3428017,5.413071,24.60813,TFAP2A;GRN;PCSK9;SNCA,Positive Regulation Of Neuron Death (GO:1901216)
GO:0071805,0.3428017,5.413071,24.60813,KCNK5;SLC12A2;ATP1A4;ATP1B1,Potassium Ion Transmembrane Transport (GO:0071805)
GO:0030520,0.3428017,8.106646,36.52748,NCOA4;PADI2;ESR1,Intracellular Estrogen Receptor Signaling Pathway (GO:0030520)
GO:0072182,0.3428017,21.57828,97.00015,PROM1;PAX2,Regulation Of Nephron Tubule Epithelial Cell Differentiation (GO:0072182)
GO:0010517,0.3428017,21.57828,97.00015,FGFR2;SNCA,Regulation Of Phospholipase Activity (GO:0010517)
GO:0061043,0.3428017,21.57828,97.00015,SLC12A2;XBP1,Regulation Of Vascular Wound Healing (GO:0061043)
GO:0097264,0.3428017,21.57828,97.00015,CASP8;CAPN1,Self Proteolysis (GO:0097264)
GO:0072175,0.3428017,21.57828,97.00015,FGFR2;PAX2,Epithelial Tube Formation (GO:0072175)
GO:1901072,0.3428017,21.57828,97.00015,GNPDA1;GNPDA2,Glucosamine-Containing Compound Catabolic Process (GO:1901072)
GO:0009313,0.3428017,21.57828,97.00015,MANBA;NEU1,Oligosaccharide Catabolic Process (GO:0009313)
GO:0034137,0.3428017,21.57828,97.00015,MFHAS1;TIRAP,Positive Regulation Of Toll-Like Receptor 2 Signaling Pathway (GO:0034137)
GO:0022407,0.3667127,5.094058,22.25974,MAGI1;JAG1;SPINT2;PLPP3,Regulation Of Cell-Cell Adhesion (GO:0022407)
GO:0042113,0.3667127,4.014702,17.53063,CASP8;BLNK;PIK3R2;MALT1;NHEJ1,B Cell Activation (GO:0042113)
GO:0050953,0.3667127,4.014702,17.53063,COL18A1;SLC4A10;DRAM2;PAX2;CRYZ,Sensory Perception Of Light Stimulus (GO:0050953)
GO:0071902,0.3667127,3.042404,13.28363,CCND2;FLT1;CCND1;TCIM;PDGFD;ATP2B4;SNCA,Positive Regulation Of Protein Serine/Threonine Kinase Activity (GO:0071902)
GO:1902533,0.3667127,1.789618,7.805583,BCAR3;FLT1;KSR1;IRAK4;MALT1;INAVA;TIRAP;TRIM8;AKAP13;MFHAS1;FLCN;CASP8;TCIM;PDGFD;LTBR;CORO7;GAS6;GAPDH;FGFR2;MYORG;GSDME,Positive Regulation Of Intracellular Signal Transduction (GO:1902533)
GO:0007229,0.3819395,3.339089,14.25377,LAMA5;ITGB4;ITGA7;PTK2B;PLPP3;CDH17,Integrin-Mediated Signaling Pathway (GO:0007229)
GO:0051966,0.3819395,7.205063,30.63058,OPHN1;CCL2;PTK2B,"Regulation Of Synaptic Transmission, Glutamatergic (GO:0051966)"
GO:0035721,0.3819395,7.205063,30.63058,DYNC2H1;IFT43;DYNLT2B,Intraciliary Retrograde Transport (GO:0035721)
GO:0070269,0.3819395,7.205063,30.63058,CASP8;CASP4;GSDME,Pyroptosis (GO:0070269)
GO:0034341,0.3819395,4.810491,20.22336,CCL20;CCL2;GAPDH;SNCA,Response To Type II Interferon (GO:0034341)
GO:1990138,0.3819395,4.810491,20.22336,IMPACT;NRN1;FLRT3;SPG11,Neuron Projection Extension (GO:1990138)
GO:0060271,0.3819395,2.164861,9.059008,DYNC2H1;IFT43;RILPL2;AVIL;DYNLT2B;ARMC9;BBS9;HYLS1;OCRL;RAB17;ATP6V1D;WDR54,Cilium Assembly (GO:0060271)
GO:0007601,0.3819395,3.736948,15.37962,COL18A1;SLC4A10;DRAM2;PAX2;CRYZ,Visual Perception (GO:0007601)
GO:0008016,0.3819395,4.556773,18.44506,ACE2;CAMK2D;S100A1;ATP2B4,Regulation Of Heart Contraction (GO:0008016)
GO:0044782,0.3819395,2.111733,8.496606,DYNC2H1;IFT43;RILPL2;AVIL;DYNLT2B;ARMC9;BBS9;HYLS1;OCRL;RAB17;ATP6V1D;WDR54,Cilium Organization (GO:0044782)
GO:0001919,0.3819395,6.483797,26.07708,PCSK9;OCRL;SNCA,Regulation Of Receptor Recycling (GO:0001919)
GO:0048705,0.3819395,6.483797,26.07708,TFAP2A;LAMA5;FGFR2,Skeletal System Morphogenesis (GO:0048705)
GO:0001701,0.3819395,6.483797,26.07708,FLCN;ZNF568;FGFR2,In Utero Embryonic Development (GO:0001701)
GO:0043491,0.3819395,6.483797,26.07708,CCL2;GAS6;PAX2,Protein Kinase B Signaling (GO:0043491)
GO:0060349,0.3819395,14.38384,57.73928,TFAP2A;FGFR2,Bone Morphogenesis (GO:0060349)
GO:1900274,0.3819395,14.38384,57.73928,FLT1;ESR1,Regulation Of Phospholipase C Activity (GO:1900274)
GO:0086003,0.3819395,14.38384,57.73928,CAMK2D;CACNA2D1,Cardiac Muscle Cell Contraction (GO:0086003)
GO:0071280,0.3819395,14.38384,57.73928,AQP1;SNCA,Cellular Response To Copper Ion (GO:0071280)
GO:0021545,0.3819395,14.38384,57.73928,TFAP2A;PAX2,Cranial Nerve Development (GO:0021545)
GO:1904659,0.3819395,14.38384,57.73928,SORT1;HNF1A,Glucose Transmembrane Transport (GO:1904659)
GO:0007033,0.3819395,14.38384,57.73928,ZFYVE26;SPG11,Vacuole Organization (GO:0007033)
GO:0033152,0.3819395,14.38384,57.73928,PRKDC;NHEJ1,Immunoglobulin V(D)J Recombination (GO:0033152)
GO:0072112,0.3819395,14.38384,57.73928,JAG1;PROM1,Podocyte Differentiation (GO:0072112)
GO:2001137,0.3819395,14.38384,57.73928,AKAP5;SORL1,Positive Regulation Of Endocytic Recycling (GO:2001137)
GO:0051047,0.3819395,14.38384,57.73928,XBP1;AQP1,Positive Regulation Of Secretion (GO:0051047)
GO:0034141,0.3819395,14.38384,57.73928,WDFY1;TIRAP,Positive Regulation Of Toll-Like Receptor 3 Signaling Pathway (GO:0034141)
GO:0048679,0.3819395,14.38384,57.73928,GRN;OCRL,Regulation Of Axon Regeneration (GO:0048679)
GO:1902514,0.3819395,14.38384,57.73928,CAMK2D;CACNA2D1,Regulation Of Calcium Ion Transmembrane Transport Via High Voltage-Gated Calcium Channel (GO:1902514)
GO:0120031,0.3849023,1.973925,7.889896,DYNC2H1;AVIL;DYNLT2B;ARMC9;OCRL;WDR54;FGD4;IFT43;OPHN1;RILPL2;BBS9;HYLS1;RAB17;ATP6V1D,Plasma Membrane Bounded Cell Projection Assembly (GO:0120031)
GO:1901565,0.3918587,3.09949,12.3045,RIDA;GNPDA1;GNPDA2;AMDHD2;GGACT;RENBP,Organonitrogen Compound Catabolic Process (GO:1901565)
GO:0010232,0.4127435,3.495034,13.5747,ABCC3;SLC12A2;ABCC5;ATP1A4;ATP2B4,Vascular Transport (GO:0010232)
GO:0098662,0.4127435,2.520401,9.779882,KCNK5;SLC12A2;ATP1A4;ATP2B4;GAS6;ATP1B1;ATP6V1D;AQP1,Inorganic Cation Transmembrane Transport (GO:0098662)
GO:0098742,0.4127435,3.027053,11.73326,IGSF11;TENM4;FLRT3;CLDN2;SCARF2;CDH17,Cell-Cell Adhesion Via Plasma-Membrane Adhesion Molecules (GO:0098742)
GO:0071345,0.4127435,2.140665,8.282258,SLC12A2;MAPK11;XBP1;CCL20;IL5RA;CCL2;TYK2;IRAK4;GAS6;GAPDH;GSDME,Cellular Response To Cytokine Stimulus (GO:0071345)
GO:0051147,0.4127435,5.893671,22.4763,MAPK11;LAMB2;FGFR2,Regulation Of Muscle Cell Differentiation (GO:0051147)
GO:0043551,0.4127435,5.893671,22.4763,FLT1;PTK2B;PIK3R2,Regulation Of Phosphatidylinositol 3-Kinase Activity (GO:0043551)
GO:0034143,0.4127435,5.893671,22.4763,MFHAS1;WDFY1;TIRAP,Regulation Of Toll-Like Receptor 4 Signaling Pathway (GO:0034143)
GO:0070098,0.4127435,5.893671,22.4763,CCL20;CCL2;PTK2B,Chemokine-Mediated Signaling Pathway (GO:0070098)
GO:0032414,0.4127435,5.893671,22.4763,CCL2;ANK3;ATP1B1,Positive Regulation Of Ion Transmembrane Transporter Activity (GO:0032414)
GO:0043525,0.4127435,5.893671,22.4763,TFAP2A;GRN;PCSK9,Positive Regulation Of Neuron Apoptotic Process (GO:0043525)
GO:1901987,0.4127435,5.893671,22.4763,CDKN1B;TCIM;ATP2B4,Regulation Of Cell Cycle Phase Transition (GO:1901987)
GO:0150104,0.4127435,3.385417,12.77928,ABCC3;SLC12A2;ABCC5;ATP1A4;ATP2B4,Transport Across Blood-Brain Barrier (GO:0150104)
GO:0008589,0.4127435,4.121827,15.50109,SUFU;ARMC9;GLI3;FGFR2,Regulation Of Smoothened Signaling Pathway (GO:0008589)
GO:0032526,0.4127435,4.121827,15.50109,CTSH;PTK2B;PAX2;AQP1,Response To Retinoic Acid (GO:0032526)
GO:0043547,0.4127435,2.08408,7.731624,RGP1;ARHGAP22;BCAR3;FLCN;ALS2;CCL20;RASGRF2;CCL2;ARAP1;GMIP;AGRN,Positive Regulation Of GTPase Activity (GO:0043547)
GO:0030163,0.4127435,2.620293,9.691852,MANBA;CASP8;OGA;PCSK9;CTSH;SOCS6;MALT1,Protein Catabolic Process (GO:0030163)
GO:0002456,0.4127435,10.78662,39.24532,JAG1;CTSH,T Cell Mediated Immunity (GO:0002456)
GO:0086001,0.4127435,10.78662,39.24532,CACNA2D1;ATP1B1,Cardiac Muscle Cell Action Potential (GO:0086001)
GO:0055119,0.4127435,10.78662,39.24532,CAMK2D;ATP1B1,Relaxation Of Cardiac Muscle (GO:0055119)
GO:0070293,0.4127435,10.78662,39.24532,WNK4;HNF1A,Renal Absorption (GO:0070293)
GO:0048566,0.4127435,10.78662,39.24532,GLI3;FGFR2,Embryonic Digestive Tract Development (GO:0048566)
GO:0036376,0.4127435,10.78662,39.24532,ATP1A4;ATP1B1,Sodium Ion Export Across Plasma Membrane (GO:0036376)
GO:0006012,0.4127435,10.78662,39.24532,GALT;GALM,Galactose Metabolic Process (GO:0006012)
GO:0046323,0.4127435,10.78662,39.24532,SORT1;HNF1A,Glucose Import (GO:0046323)
GO:0016139,0.4127435,10.78662,39.24532,FUCA2;GUSB,Glycoside Catabolic Process (GO:0016139)
GO:0072676,0.4127435,10.78662,39.24532,CCL20;CCL2,Lymphocyte Migration (GO:0072676)
GO:0010944,0.4127435,10.78662,39.24532,MAD2L2;TFAP2A,Negative Regulation Of Transcription By Competitive Promoter Binding (GO:0010944)
GO:1905247,0.4127435,10.78662,39.24532,EFNA1;GRN,Positive Regulation Of Aspartic-Type Peptidase Activity (GO:1905247)
GO:0032816,0.4127435,10.78662,39.24532,TYK2;GAS6,Positive Regulation Of Natural Killer Cell Activation (GO:0032816)
GO:2000651,0.4127435,10.78662,39.24532,ANK3;ATP1B1,Positive Regulation Of Sodium Ion Transmembrane Transporter Activity (GO:2000651)
GO:0034145,0.4127435,10.78662,39.24532,WDFY1;TIRAP,Positive Regulation Of Toll-Like Receptor 4 Signaling Pathway (GO:0034145)
GO:0051489,0.4127435,3.93401,14.27405,MIEN1;ARAP1;RAB17;AGRN,Regulation Of Filopodium Assembly (GO:0051489)
GO:0071900,0.4127435,2.575578,9.334155,CDKN2B;CCNT2;CCND2;CDKN1B;CCND1;KSR1;SNCA,Regulation Of Protein Serine/Threonine Kinase Activity (GO:0071900)
GO:0003208,0.4127435,5.401899,19.5728,JAG1;CPE;FGFR2,Cardiac Ventricle Morphogenesis (GO:0003208)
GO:0071300,0.4127435,5.401899,19.5728,PTK2B;PAX2;AQP1,Cellular Response To Retinoic Acid (GO:0071300)
GO:0048565,0.4127435,5.401899,19.5728,CDX2;GLI3;FGFR2,Digestive Tract Development (GO:0048565)
GO:0009311,0.4127435,5.401899,19.5728,MANBA;NEU1;ST3GAL4,Oligosaccharide Metabolic Process (GO:0009311)
GO:0008154,0.4272254,3.185526,11.36709,ENAH;VIL1;SVIL;AVIL;CORO7,Actin Polymerization Or Depolymerization (GO:0008154)
GO:0006006,0.4272254,3.185526,11.36709,PFKFB1;HKDC1;GALM;ENO2;ENO3,Glucose Metabolic Process (GO:0006006)
GO:0033138,0.4272254,3.185526,11.36709,BCAR3;MAD2L2;ATP2B4;GAS6;SNCA,Positive Regulation Of Peptidyl-Serine Phosphorylation (GO:0033138)
GO:0033674,0.4285472,2.768129,9.764904,DSTYK;FLT1;ALS2;PTK2B;GAS6;FGFR2,Positive Regulation Of Kinase Activity (GO:0033674)
GO:0008544,0.4285472,3.762525,13.17885,LAMB3;LAMC2;SPRR1A;FGFR2,Epidermis Development (GO:0008544)
GO:0031324,0.4285472,3.762525,13.17885,TFAP2A;FLCN;AKT3;PAX2,Negative Regulation Of Cellular Metabolic Process (GO:0031324)
GO:0007409,0.4285472,2.317128,8.063141,EFNA1;ENAH;OPHN1;ANK3;APBB1;SPG11;FGFR2;PAX2,Axonogenesis (GO:0007409)
GO:0050678,0.4285472,3.094148,10.73875,GRN;CDKN2B;PRKDC;PAX2;FGFR2,Regulation Of Epithelial Cell Proliferation (GO:0050678)
GO:0000904,0.4285472,4.985784,17.19311,OPHN1;RILPL2;TBCD,Cell Morphogenesis Involved In Differentiation (GO:0000904)
GO:0002028,0.4285472,4.985784,17.19311,WNK4;ATP2B4;ANK3,Regulation Of Sodium Ion Transport (GO:0002028)
GO:0001706,0.4285472,4.985784,17.19311,DUSP4;LAMB3;ITGA7,Endoderm Formation (GO:0001706)
GO:0035725,0.4285472,4.985784,17.19311,SLC12A2;ATP1A4;ATP1B1,Sodium Ion Transmembrane Transport (GO:0035725)
GO:1990266,0.4285472,4.985784,17.19311,CCL20;CCL2;IRAK4,Neutrophil Migration (GO:1990266)
GO:0006813,0.4285472,4.985784,17.19311,KCNK5;ATP1A4;AQP1,Potassium Ion Transport (GO:0006813)
GO:0030334,0.4285472,1.71281,5.906122,XBP1;GRN;FLT1;JAG1;LAMC2;SORL1;VIL1;CAMSAP3;FLCN;MIEN1;PDGFD;PDPN;PLXNA2;CTSH;PTK2B;SGK3;SRGAP1,Regulation Of Cell Migration (GO:0030334)
GO:0048666,0.4285472,2.28637,7.81387,UGDH;XBP1;OPHN1;TENM4;FLRT3;TBCD;STX3;HS6ST1,Neuron Development (GO:0048666)
GO:0007169,0.4285472,1.979328,6.751483,EFNA1;BCAR3;FLT1;FLRT3;SORT1;PDGFD;BLNK;PTK2B;PIK3R2;FRK;FGFR2,Transmembrane Receptor Protein Tyrosine Kinase Signaling Pathway (GO:0007169)
GO:0071260,0.4285472,3.60533,12.19712,MAP3K2;CASP8;LTBR;AQP1,Cellular Response To Mechanical Stimulus (GO:0071260)
GO:0080171,0.4285472,3.60533,12.19712,GRN;ZFYVE26;HPS1;SPG11,Lytic Vacuole Organization (GO:0080171)
GO:0043549,0.4285472,3.007846,10.1557,RBL2;DSTYK;CDKN1B;FLT1;FGFR2,Regulation Of Kinase Activity (GO:0043549)
GO:0009967,0.4285472,1.962871,6.602263,XBP1;DSTYK;JAG1;LAMB2;ARMC9;CTSH;PTK2B;GAS6;SORL1;FGFR2;MYORG,Positive Regulation Of Signal Transduction (GO:0009967)
GO:0043123,0.4285472,2.126271,7.099504,TRIM8;AKAP13;CASP8;IRAK4;LTBR;GAPDH;INAVA;TIRAP;MALT1,Positive Regulation Of I-kappaB kinase/NF-kappaB Signaling (GO:0043123)
GO:0042127,0.4285472,1.528673,5.096003,COL18A1;CDKN1B;PRKDC;LAMC2;CCND2;PDGFD;PDPN;CTSH;PTK2B;CAPN1;VHL;STX3;DIS3L2;TFAP2A;CGREF1;XBP1;CDKN2B;JAG1;KSR1;DHPS;ACE2;ACER3;SGK3;FGFR2;GSDME,Regulation Of Cell Population Proliferation (GO:0042127)
GO:0070252,0.4285472,8.628283,28.744,CAMK2D;PDPN,Actin-Mediated Cell Contraction (GO:0070252)
GO:0010738,0.4285472,8.628283,28.744,TCIM;AKAP5,Regulation Of Protein Kinase A Signaling (GO:0010738)
GO:0071493,0.4285472,8.628283,28.744,MAPK11;CRIP1,Cellular Response To UV-B (GO:0071493)
GO:0034135,0.4285472,8.628283,28.744,MFHAS1;TIRAP,Regulation Of Toll-Like Receptor 2 Signaling Pathway (GO:0034135)
GO:0034139,0.4285472,8.628283,28.744,WDFY1;TIRAP,Regulation Of Toll-Like Receptor 3 Signaling Pathway (GO:0034139)
GO:0090075,0.4285472,8.628283,28.744,CAMK2D;ATP1B1,Relaxation Of Muscle (GO:0090075)
GO:0030323,0.4285472,8.628283,28.744,PDPN;FGFR2,Respiratory Tube Development (GO:0030323)
GO:0010039,0.4285472,8.628283,28.744,TFAP2A;SNCA,Response To Iron Ion (GO:0010039)
GO:0042417,0.4285472,8.628283,28.744,MAOA;SNCA,Dopamine Metabolic Process (GO:0042417)
GO:0048701,0.4285472,8.628283,28.744,TFAP2A;FGFR2,Embryonic Cranial Skeleton Morphogenesis (GO:0048701)
GO:1901071,0.4285472,8.628283,28.744,OGA;RENBP,Glucosamine-Containing Compound Metabolic Process (GO:1901071)
GO:0001656,0.4285472,8.628283,28.744,CTSH;PAX2,Metanephros Development (GO:0001656)
GO:0001774,0.4285472,8.628283,28.744,GRN;SNCA,Microglial Cell Activation (GO:0001774)
GO:0090084,0.4285472,8.628283,28.744,HSPA2;SORL1,Negative Regulation Of Inclusion Body Assembly (GO:0090084)
GO:2000650,0.4285472,8.628283,28.744,CAMK2D;PCSK9,Negative Regulation Of Sodium Ion Transmembrane Transporter Activity (GO:2000650)
GO:0038066,0.4285472,8.628283,28.744,MAPK11;MAP2K6,p38MAPK Cascade (GO:0038066)
GO:0001921,0.4285472,8.628283,28.744,OCRL;SNCA,Positive Regulation Of Receptor Recycling (GO:0001921)
GO:2000404,0.4285472,8.628283,28.744,TMEM102;CCL20,Regulation Of T Cell Migration (GO:2000404)
GO:1902959,0.4285472,8.628283,28.744,EFNA1;SORL1,Regulation Of Aspartic-Type Endopeptidase Activity Involved In Amyloid Precursor Protein Catabolic Process (GO:1902959)
GO:0070925,0.4322534,1.712966,5.682635,DYNC2H1;UBXN2A;AVIL;DYNLT2B;HPS1;ARMC9;HPS3;OCRL;WDR54;IFT43;RILPL2;ATG16L1;BBS9;HYLS1;RAB17;ATP6V1D,Organelle Assembly (GO:0070925)
GO:0030217,0.4377903,4.629114,15.2156,PIK3R2;GLI3;NHEJ1,T Cell Differentiation (GO:0030217)
GO:0071331,0.4377903,4.629114,15.2156,XBP1;GAS6;PAX2,Cellular Response To Hexose Stimulus (GO:0071331)
GO:0050871,0.4377903,4.629114,15.2156,MAD2L2;XBP1;TIRAP,Positive Regulation Of B Cell Activation (GO:0050871)
GO:0019318,0.4377903,3.460711,11.31364,GALT;HKDC1;FUCA2;GALM,Hexose Metabolic Process (GO:0019318)
GO:0030182,0.4377903,2.54982,8.201095,UGDH;XBP1;OPHN1;TENM4;PCSK9;HS6ST1,Neuron Differentiation (GO:0030182)
GO:1901215,0.4377903,2.848868,9.109168,GRN;CCL2;PTK2B;SORL1;SNCA,Negative Regulation Of Neuron Death (GO:1901215)
GO:2000147,0.4377903,1.958763,6.166892,VIL1;XBP1;GRN;FLT1;MIEN1;PDGFD;PDPN;CTSH;PTK2B;LAMC2,Positive Regulation Of Cell Motility (GO:2000147)
GO:0032868,0.4377903,2.500491,7.860747,XBP1;PKLR;PRKDC;SORT1;PCSK9;PIK3R2,Response To Insulin (GO:0032868)
GO:0034332,0.4377903,4.32,13.55269,TBCD;CDH17;INAVA,Adherens Junction Organization (GO:0034332)
GO:0070830,0.4377903,4.32,13.55269,MARVELD2;TBCD;CLDN2,Bicellular Tight Junction Assembly (GO:0070830)
GO:0031952,0.4377903,4.32,13.55269,TOM1L1;IMPACT;PDGFD,Regulation Of Protein Autophosphorylation (GO:0031952)
GO:0043009,0.4377903,4.32,13.55269,FLCN;ZNF568;FGFR2,Chordate Embryonic Development (GO:0043009)
GO:0031571,0.4377903,4.32,13.55269,CDKN1B;CCND1;PRKDC,Mitotic G1 DNA Damage Checkpoint Signaling (GO:0031571)
GO:0032675,0.4377903,2.775494,8.63867,XBP1;EOLA1;GAS6;INAVA;TIRAP,Regulation Of Interleukin-6 Production (GO:0032675)
GO:2000345,0.4377903,inf,inf,XBP1,Regulation Of Hepatocyte Proliferation (GO:2000345)
GO:0001913,0.4377903,inf,inf,CTSH,T Cell Mediated Cytotoxicity (GO:0001913)
GO:0051937,0.4377903,inf,inf,SLC29A3,Catecholamine Transport (GO:0051937)
GO:0060075,0.4377903,inf,inf,KCNK5,Regulation Of Resting Membrane Potential (GO:0060075)
GO:0061318,0.4377903,inf,inf,PROM1,Renal Filtration Cell Differentiation (GO:0061318)
GO:0072044,0.4377903,inf,inf,PAX2,Collecting Duct Development (GO:0072044)
GO:0090494,0.4377903,inf,inf,SNCA,Dopamine Uptake (GO:0090494)
GO:0001963,0.4377903,inf,inf,SNCA,"Synaptic Transmission, Dopaminergic (GO:0001963)"
GO:0072311,0.4377903,inf,inf,PROM1,Glomerular Epithelial Cell Differentiation (GO:0072311)
GO:0021559,0.4377903,inf,inf,TFAP2A,Trigeminal Nerve Development (GO:0021559)
GO:1901750,0.4377903,inf,inf,GGTA1,Leukotriene D4 Biosynthetic Process (GO:1901750)
GO:1901748,0.4377903,inf,inf,GGTA1,Leukotriene D4 Metabolic Process (GO:1901748)
GO:0072205,0.4377903,inf,inf,PAX2,Metanephric Collecting Duct Development (GO:0072205)
GO:0015844,0.4377903,inf,inf,SLC29A3,Monoamine Transport (GO:0015844)
GO:2000669,0.4377903,inf,inf,GAS6,Negative Regulation Of Dendritic Cell Apoptotic Process (GO:2000669)
GO:0015874,0.4377903,inf,inf,SLC29A3,Norepinephrine Transport (GO:0015874)
GO:0034587,0.4377903,inf,inf,TDRKH,piRNA Processing (GO:0034587)
GO:2000321,0.4377903,inf,inf,MALT1,Positive Regulation Of T-helper 17 Cell Differentiation (GO:2000321)
GO:1900426,0.4377903,inf,inf,GRN,Positive Regulation Of Defense Response To Bacterium (GO:1900426)
GO:1903238,0.4377903,inf,inf,ST3GAL4,Positive Regulation Of Leukocyte Tethering Or Rolling (GO:1903238)
GO:0097623,0.4377903,inf,inf,KCNK5,Potassium Ion Export Across Plasma Membrane (GO:0097623)
GO:0033623,0.4377903,7.189394,22.09357,FERMT1;FBLIM1,Regulation Of Integrin Activation (GO:0033623)
GO:0099601,0.4377903,7.189394,22.09357,PTK2B;CAPN1,Regulation Of Neurotransmitter Receptor Activity (GO:0099601)
GO:0060048,0.4377903,7.189394,22.09357,CAMK2D;ATP1B1,Cardiac Muscle Contraction (GO:0060048)
GO:0046514,0.4377903,7.189394,22.09357,ACER3;NEU1,Ceramide Catabolic Process (GO:0046514)
GO:0046688,0.4377903,7.189394,22.09357,AQP1;SNCA,Response To Copper Ion (GO:0046688)
GO:0048704,0.4377903,7.189394,22.09357,TFAP2A;FGFR2,Embryonic Skeletal System Morphogenesis (GO:0048704)
GO:0016447,0.4377903,7.189394,22.09357,PRKDC;NHEJ1,Somatic Recombination Of Immunoglobulin Gene Segments (GO:0016447)
