term,fdr,Odds Ratio,Combined Score,Genes,description
GO:0090181,0.6766753,1.835459,1.528592,EPHX2,Regulation Of Cholesterol Metabolic Process (GO:0090181)
GO:0090175,0.6766753,1.835459,1.528592,CELSR1,Regulation Of Establishment Of Planar Polarity (GO:0090175)
GO:0007254,0.6766753,1.835459,1.528592,LRRK2,JNK Cascade (GO:0007254)
GO:0031056,0.6766753,1.835459,1.528592,MTHFR,Regulation Of Histone Modification (GO:0031056)
GO:0060071,0.6766753,1.835459,1.528592,CELSR1,"Wnt Signaling Pathway, Planar Cell Polarity Pathway (GO:0060071)"
GO:0009083,0.6766753,1.835459,1.528592,BCKDHB,Branched-Chain Amino Acid Catabolic Process (GO:0009083)
GO:0046942,0.6766753,1.835459,1.528592,SLC38A1,Carboxylic Acid Transport (GO:0046942)
GO:0071331,0.6766753,1.835459,1.528592,PDK3,Cellular Response To Hexose Stimulus (GO:0071331)
GO:0030970,0.6766753,1.835459,1.528592,SELENOS,"Retrograde Protein Transport, ER To Cytosol (GO:0030970)"
GO:0000041,0.6766753,1.835459,1.528592,SLC39A8,Transition Metal Ion Transport (GO:0000041)
GO:0006664,0.6766753,1.835459,1.528592,ST3GAL6,Glycolipid Metabolic Process (GO:0006664)
GO:0030203,0.6766753,1.835459,1.528592,EXT2,Glycosaminoglycan Metabolic Process (GO:0030203)
GO:0035459,0.6766753,1.835459,1.528592,SEC24D,Vesicle Cargo Loading (GO:0035459)
GO:1903232,0.6766753,1.835459,1.528592,RAB38,Melanosome Assembly (GO:1903232)
GO:0033119,0.6766753,1.835459,1.528592,PCBP4,Negative Regulation Of RNA Splicing (GO:0033119)
GO:0010633,0.6766753,1.835459,1.528592,PTPRG,Negative Regulation Of Epithelial Cell Migration (GO:0010633)
GO:0090317,0.6766753,1.835459,1.528592,LRRK2,Negative Regulation Of Intracellular Protein Transport (GO:0090317)
GO:0051283,0.6766753,1.835459,1.528592,PLCD1,Negative Regulation Of Sequestering Of Calcium Ion (GO:0051283)
GO:0035335,0.6766753,1.835459,1.528592,TNS2,Peptidyl-Tyrosine Dephosphorylation (GO:0035335)
GO:0032722,0.6766753,1.835459,1.528592,IL17RA,Positive Regulation Of Chemokine Production (GO:0032722)
GO:0010592,0.6766753,1.835459,1.528592,FSCN1,Positive Regulation Of Lamellipodium Assembly (GO:0010592)
GO:0045931,0.6766753,1.835459,1.528592,TTL,Positive Regulation Of Mitotic Cell Cycle (GO:0045931)
GO:0045937,0.6766753,1.835459,1.528592,KCTD20,Positive Regulation Of Phosphate Metabolic Process (GO:0045937)
GO:0032986,0.6766753,1.835459,1.528592,MYC,protein-DNA Complex Disassembly (GO:0032986)
GO:1901888,0.6766753,1.835459,1.528592,SETD5,Regulation Of Cell Junction Assembly (GO:1901888)
GO:0006338,0.6801137,1.124564,0.9297607,PARP2;MYC;SETDB2;CHD6;MTHFR;ESR1;MTA3,Chromatin Remodeling (GO:0006338)
GO:0007229,0.6833182,1.366299,1.121877,TEC;FBLN1,Integrin-Mediated Signaling Pathway (GO:0007229)
GO:0032102,0.6870946,1.241414,1.010226,SELENOS;CD109;SLC39A8,Negative Regulation Of Response To External Stimulus (GO:0032102)
GO:0006289,0.6870946,1.335092,1.062618,FSCN1;TENT4A,Nucleotide-Excision Repair (GO:0006289)
GO:0010976,0.6870946,1.335092,1.062618,PTK7;ROR2,Positive Regulation Of Neuron Projection Development (GO:0010976)
GO:0051056,0.6870946,1.22403,0.9722777,ARHGAP32;NGEF;FGD1,Regulation Of Small GTPase Mediated Signal Transduction (GO:0051056)
GO:2000351,0.6870946,1.727291,1.365874,CCL2,Regulation Of Endothelial Cell Apoptotic Process (GO:2000351)
GO:0003176,0.6870946,1.727291,1.365874,TNFRSF1B,Aortic Valve Development (GO:0003176)
GO:0008206,0.6870946,1.727291,1.365874,OSBPL6,Bile Acid Metabolic Process (GO:0008206)
GO:0031952,0.6870946,1.727291,1.365874,IMPACT,Regulation Of Protein Autophosphorylation (GO:0031952)
GO:1905475,0.6870946,1.727291,1.365874,APPL1,Regulation Of Protein Localization To Membrane (GO:1905475)
GO:0044271,0.6870946,1.727291,1.365874,GCHFR,Cellular Nitrogen Compound Biosynthetic Process (GO:0044271)
GO:0090224,0.6870946,1.727291,1.365874,GNAI1,Regulation Of Spindle Organization (GO:0090224)
GO:1904705,0.6870946,1.727291,1.365874,JUN,Regulation Of Vascular Associated Smooth Muscle Cell Proliferation (GO:1904705)
GO:0043009,0.6870946,1.727291,1.365874,SIX4,Chordate Embryonic Development (GO:0043009)
GO:0043627,0.6870946,1.727291,1.365874,ESR1,Response To Estrogen (GO:0043627)
GO:0002753,0.6870946,1.727291,1.365874,STING1,Cytosolic Pattern Recognition Receptor Signaling Pathway (GO:0002753)
GO:0035088,0.6870946,1.727291,1.365874,FSCN1,Establishment Or Maintenance Of Apical/Basal Cell Polarity (GO:0035088)
GO:0071621,0.6870946,1.727291,1.365874,CCL2,Granulocyte Chemotaxis (GO:0071621)
GO:0001889,0.6870946,1.727291,1.365874,E2F7,Liver Development (GO:0001889)
GO:0045747,0.6870946,1.727291,1.365874,TSPAN14,Positive Regulation Of Notch Signaling Pathway (GO:0045747)
GO:1903846,0.6870946,1.727291,1.365874,ZEB2,Positive Regulation Of Cellular Response To Transforming Growth Factor Beta Stimulus (GO:1903846)
GO:0032376,0.6870946,1.727291,1.365874,RXRA,Positive Regulation Of Cholesterol Transport (GO:0032376)
GO:0051984,0.6870946,1.727291,1.365874,CDC6,Positive Regulation Of Chromosome Segregation (GO:0051984)
GO:0030511,0.6870946,1.727291,1.365874,ZEB2,Positive Regulation Of Transforming Growth Factor Beta Receptor Signaling Pathway (GO:0030511)
GO:0140238,0.6870946,1.727291,1.365874,DNM1,Presynaptic Endocytosis (GO:0140238)
GO:0008064,0.6870946,1.727291,1.365874,MEGF9,Regulation Of Actin Polymerization Or Depolymerization (GO:0008064)
GO:0030193,0.6870946,1.727291,1.365874,THBD,Regulation Of Blood Coagulation (GO:0030193)
GO:0008285,0.6941556,1.099989,0.856454,MYC;IGFBP3;FBLN1;CDC6;ADARB1;E2F7;TNS2,Negative Regulation Of Cell Population Proliferation (GO:0008285)
GO:0045597,0.6941556,1.129973,0.875346,IMPACT;GLIPR2;IGFBP3;NID1;MAPK12,Positive Regulation Of Cell Differentiation (GO:0045597)
GO:0043523,0.6941556,1.305271,1.007171,SIX4;CCL2,Regulation Of Neuron Apoptotic Process (GO:0043523)
GO:1905037,0.6941556,1.305271,1.007171,STING1;ATG14,Autophagosome Organization (GO:1905037)
GO:0061912,0.6941556,1.305271,1.007171,STING1;ATG14,Selective Autophagy (GO:0061912)
GO:0051495,0.6941556,1.305271,1.007171,PDXP;PLXNA3,Positive Regulation Of Cytoskeleton Organization (GO:0051495)
GO:0031329,0.6941556,1.305271,1.007171,LRRK2;SOGA1,Regulation Of Cellular Catabolic Process (GO:0031329)
GO:0000725,0.6941556,1.19067,0.9012157,BLM;FSCN1;SPIDR,Recombinational Repair (GO:0000725)
GO:0050773,0.6941556,1.631141,1.226147,SDC2,Regulation Of Dendrite Development (GO:0050773)
GO:1902475,0.6941556,1.631141,1.226147,SLC38A1,L-alpha-amino Acid Transmembrane Transport (GO:1902475)
GO:0006865,0.6941556,1.631141,1.226147,SLC38A1,Amino Acid Transport (GO:0006865)
GO:0051960,0.6941556,1.631141,1.226147,TNFRSF1B,Regulation Of Nervous System Development (GO:0051960)
GO:0060326,0.6941556,1.631141,1.226147,LPAR1,Cell Chemotaxis (GO:0060326)
GO:0002831,0.6941556,1.631141,1.226147,APPL1,Regulation Of Response To Biotic Stimulus (GO:0002831)
GO:0071470,0.6941556,1.631141,1.226147,TRPV4,Cellular Response To Osmotic Stress (GO:0071470)
GO:0051209,0.6941556,1.631141,1.226147,PLCD1,Release Of Sequestered Calcium Ion Into Cytosol (GO:0051209)
GO:0032469,0.6941556,1.631141,1.226147,SELENOK,Endoplasmic Reticulum Calcium Ion Homeostasis (GO:0032469)
GO:0043542,0.6941556,1.631141,1.226147,ID1,Endothelial Cell Migration (GO:0043542)
GO:0051452,0.6941556,1.631141,1.226147,RAB38,Intracellular pH Reduction (GO:0051452)
GO:0070059,0.6941556,1.631141,1.226147,SELENOK,Intrinsic Apoptotic Signaling Pathway In Response To Endoplasmic Reticulum Stress (GO:0070059)
GO:0001937,0.6941556,1.631141,1.226147,CCL2,Negative Regulation Of Endothelial Cell Proliferation (GO:0001937)
GO:0062014,0.6941556,1.631141,1.226147,SOGA1,Negative Regulation Of Small Molecule Metabolic Process (GO:0062014)
GO:0032720,0.6941556,1.631141,1.226147,SELENOS,Negative Regulation Of Tumor Necrosis Factor Production (GO:0032720)
GO:1903556,0.6941556,1.631141,1.226147,SELENOS,Negative Regulation Of Tumor Necrosis Factor Superfamily Cytokine Production (GO:1903556)
GO:0048285,0.6941556,1.631141,1.226147,SLC25A46,Organelle Fission (GO:0048285)
GO:0050772,0.6941556,1.631141,1.226147,PLXNA3,Positive Regulation Of Axonogenesis (GO:0050772)
GO:0010942,0.6941556,1.631141,1.226147,LRRK2,Positive Regulation Of Cell Death (GO:0010942)
GO:0045724,0.6941556,1.631141,1.226147,HTT,Positive Regulation Of Cilium Assembly (GO:0045724)
GO:0001961,0.6941556,1.631141,1.226147,STING1,Positive Regulation Of Cytokine-Mediated Signaling Pathway (GO:0001961)
GO:0043516,0.6941556,1.631141,1.226147,ATR,"Regulation Of DNA Damage Response, Signal Transduction By P53 Class Mediator (GO:0043516)"
GO:0090109,0.6941556,1.631141,1.226147,GPM6B,Regulation Of Cell-Substrate Junction Assembly (GO:0090109)
GO:0051241,0.6943441,1.140627,0.856067,ID1;TIMP1;IP6K1;PTPRG,Negative Regulation Of Multicellular Organismal Process (GO:0051241)
GO:1902017,0.6947026,1.276747,0.9552334,TCHP;HTT,Regulation Of Cilium Assembly (GO:1902017)
GO:0032091,0.6947026,1.276747,0.9552334,LRRK2;STYX,Negative Regulation Of Protein Binding (GO:0032091)
GO:0043065,0.6960886,1.094672,0.815827,JUN;IGFBP3;JMY;HTRA1;HTT;OMA1,Positive Regulation Of Apoptotic Process (GO:0043065)
GO:0006302,0.7005995,1.104096,0.810168,BLM;PARP2;FSCN1;TENT4A;SPIDR,Double-Strand Break Repair (GO:0006302)
GO:0042325,0.7005995,1.249437,0.9065335,KCTD20;ATG14,Regulation Of Phosphorylation (GO:0042325)
GO:0043433,0.7005995,1.159066,0.8360635,LRRK2;ID1;ESR1,Negative Regulation Of DNA-binding Transcription Factor Activity (GO:0043433)
GO:2000045,0.7005995,1.159066,0.8360635,CCL2;E2F7;APPL1,Regulation Of G1/S Transition Of Mitotic Cell Cycle (GO:2000045)
GO:0031328,0.7005995,1.118639,0.8059298,ZEB2;SAMD4A;EIF4G3;APPL1,Positive Regulation Of Cellular Biosynthetic Process (GO:0031328)
GO:0050691,0.7005995,1.545113,1.105288,STING1,Regulation Of Defense Response To Virus By Host (GO:0050691)
GO:0048638,0.7005995,1.545113,1.105288,SIX4,Regulation Of Developmental Growth (GO:0048638)
GO:0032663,0.7005995,1.545113,1.105288,NAV3,Regulation Of Interleukin-2 Production (GO:0032663)
GO:0035751,0.7005995,1.545113,1.105288,LRRK2,Regulation Of Lysosomal Lumen pH (GO:0035751)
GO:0090140,0.7005995,1.545113,1.105288,LRRK2,Regulation Of Mitochondrial Fission (GO:0090140)
GO:0140374,0.7005995,1.545113,1.105288,STING1,Antiviral Innate Immune Response (GO:0140374)
GO:1901137,0.7005995,1.545113,1.105288,ST3GAL6,Carbohydrate Derivative Biosynthetic Process (GO:1901137)
GO:2000008,0.7005995,1.545113,1.105288,GPM6B,Regulation Of Protein Localization To Cell Surface (GO:2000008)
GO:1901655,0.7005995,1.545113,1.105288,GNAI1,Cellular Response To Ketone (GO:1901655)
GO:0071346,0.7005995,1.545113,1.105288,CCL2,Cellular Response To Type II Interferon (GO:0071346)
GO:1901652,0.7005995,1.545113,1.105288,GNAI1,Response To Peptide (GO:1901652)
GO:0045022,0.7005995,1.545113,1.105288,ATG14,Early Endosome To Late Endosome Transport (GO:0045022)
GO:0071526,0.7005995,1.545113,1.105288,PLXNA3,Semaphorin-Plexin Signaling Pathway (GO:0071526)
GO:0072666,0.7005995,1.545113,1.105288,VPS13D,Establishment Of Protein Localization To Vacuole (GO:0072666)
GO:0048017,0.7005995,1.545113,1.105288,PLCD1,Inositol Lipid-Mediated Signaling (GO:0048017)
GO:0045912,0.7005995,1.545113,1.105288,SOGA1,Negative Regulation Of Carbohydrate Metabolic Process (GO:0045912)
GO:0045806,0.7005995,1.545113,1.105288,SCAMP5,Negative Regulation Of Endocytosis (GO:0045806)
GO:1903531,0.7005995,1.545113,1.105288,TNFRSF1B,Negative Regulation Of Secretion By Cell (GO:1903531)
GO:0045332,0.7005995,1.545113,1.105288,ATP8B2,Phospholipid Translocation (GO:0045332)
GO:0048661,0.7005995,1.545113,1.105288,JUN,Positive Regulation Of Smooth Muscle Cell Proliferation (GO:0048661)
GO:0045047,0.7005995,1.545113,1.105288,SGTB,Protein Targeting To ER (GO:0045047)
GO:0045892,0.7023608,1.028586,0.7322933,JUN;NFIX;SETDB2;PRDM5;ZBTB10;NR2F1;MACROH2A2;ESR1;IMPACT;ZEB2;RXRA;NFIL3;SIX4;NSD1;MYC;ID1;MTA3;E2F7,Negative Regulation Of DNA-templated Transcription (GO:0045892)
GO:0000079,0.7069063,1.223265,0.860824,BLM;CDC6,Regulation Of Cyclin-Dependent Protein Serine/Threonine Kinase Activity (GO:0000079)
GO:0009150,0.7069063,1.223265,0.860824,LRRK2;AK4,Purine Ribonucleotide Metabolic Process (GO:0009150)
GO:0030003,0.7127162,1.129083,0.7762447,MYC;TRPV4;SLC39A8,Intracellular Monoatomic Cation Homeostasis (GO:0030003)
GO:0009062,0.7127162,1.198161,0.8178803,ABHD1;LPIN1,Fatty Acid Catabolic Process (GO:0009062)
GO:0010874,0.7127162,1.467687,1.000068,RXRA,Regulation Of Cholesterol Efflux (GO:0010874)
GO:0030041,0.7127162,1.467687,1.000068,DIAPH3,Actin Filament Polymerization (GO:0030041)
GO:0003333,0.7127162,1.467687,1.000068,SLC38A1,Amino Acid Transmembrane Transport (GO:0003333)
GO:0008535,0.7127162,1.467687,1.000068,SLC25A46,Respiratory Chain Complex IV Assembly (GO:0008535)
GO:0030261,0.7127162,1.467687,1.000068,TENT4A,Chromosome Condensation (GO:0030261)
GO:0050890,0.7127162,1.467687,1.000068,SETD5,Cognition (GO:0050890)
GO:0098927,0.7127162,1.467687,1.000068,ATG14,Vesicle-Mediated Transport Between Endosomal Compartments (GO:0098927)
GO:0051568,0.7127162,1.467687,1.000068,SETD1B,Histone H3-K4 Methylation (GO:0051568)
GO:0042552,0.7127162,1.467687,1.000068,GPM6B,Myelination (GO:0042552)
GO:0046579,0.7127162,1.467687,1.000068,LPAR1,Positive Regulation Of Ras Protein Signal Transduction (GO:0046579)
GO:0051781,0.7127162,1.467687,1.000068,CDC6,Positive Regulation Of Cell Division (GO:0051781)
GO:0032467,0.7127162,1.467687,1.000068,CDC6,Positive Regulation Of Cytokinesis (GO:0032467)
GO:0045070,0.7127162,1.467687,1.000068,ADARB1,Positive Regulation Of Viral Genome Replication (GO:0045070)
GO:0051261,0.7127162,1.467687,1.000068,MICAL1,Protein Depolymerization (GO:0051261)
GO:0000045,0.7199375,1.174061,0.7774985,STING1;ATG14,Autophagosome Assembly (GO:0000045)
GO:0006446,0.7199375,1.174061,0.7774985,IMPACT;EIF4G3,Regulation Of Translational Initiation (GO:0006446)
GO:0034614,0.7199375,1.174061,0.7774985,JUN;CAMKK2,Cellular Response To Reactive Oxygen Species (GO:0034614)
GO:0034612,0.7199375,1.174061,0.7774985,LRRK2;CCL2,Response To Tumor Necrosis Factor (GO:0034612)
GO:0010591,0.7199375,1.397635,0.9079268,FSCN1,Regulation Of Lamellipodium Assembly (GO:0010591)
GO:0043666,0.7199375,1.397635,0.9079268,HTT,Regulation Of Phosphoprotein Phosphatase Activity (GO:0043666)
GO:1905039,0.7199375,1.397635,0.9079268,SLC38A1,Carboxylic Acid Transmembrane Transport (GO:1905039)
GO:0048660,0.7199375,1.397635,0.9079268,IGFBP3,Regulation Of Smooth Muscle Cell Proliferation (GO:0048660)
GO:0071333,0.7199375,1.397635,0.9079268,PDK3,Cellular Response To Glucose Stimulus (GO:0071333)
GO:0060338,0.7199375,1.397635,0.9079268,STING1,Regulation Of Type I Interferon-Mediated Signaling Pathway (GO:0060338)
GO:0034341,0.7199375,1.397635,0.9079268,CCL2,Response To Type II Interferon (GO:0034341)
GO:0061028,0.7199375,1.397635,0.9079268,TJP3,Establishment Of Endothelial Barrier (GO:0061028)
GO:0034446,0.7199375,1.397635,0.9079268,EPHB3,Substrate Adhesion-Dependent Cell Spreading (GO:0034446)
GO:0045229,0.7199375,1.397635,0.9079268,SLC39A8,External Encapsulating Structure Organization (GO:0045229)
GO:0043062,0.7199375,1.397635,0.9079268,SLC39A8,Extracellular Structure Organization (GO:0043062)
GO:0008334,0.7199375,1.397635,0.9079268,TUT4,Histone mRNA Metabolic Process (GO:0008334)
GO:0015698,0.7199375,1.397635,0.9079268,CLCN6,Inorganic Anion Transport (GO:0015698)
GO:2000780,0.7199375,1.397635,0.9079268,FANCB,Negative Regulation Of Double-Strand Break Repair (GO:2000780)
GO:0031111,0.7199375,1.397635,0.9079268,NAV3,Negative Regulation Of Microtubule Polymerization Or Depolymerization (GO:0031111)
GO:0045930,0.7199375,1.397635,0.9079268,NME6,Negative Regulation Of Mitotic Cell Cycle (GO:0045930)
GO:1990138,0.7199375,1.397635,0.9079268,IMPACT,Neuron Projection Extension (GO:1990138)
GO:0035567,0.7199375,1.397635,0.9079268,CELSR1,Non-Canonical Wnt Signaling Pathway (GO:0035567)
GO:0032731,0.7199375,1.397635,0.9079268,PANX1,Positive Regulation Of Interleukin-1 Beta Production (GO:0032731)
GO:0031116,0.7199375,1.397635,0.9079268,NAV3,Positive Regulation Of Microtubule Polymerization (GO:0031116)
GO:0050766,0.7199375,1.397635,0.9079268,CCL2,Positive Regulation Of Phagocytosis (GO:0050766)
GO:0001510,0.7231946,1.150907,0.7394928,LCMT2;TARBP1,RNA Methylation (GO:0001510)
GO:0032200,0.7231946,1.150907,0.7394928,BLM;ATR,Telomere Organization (GO:0032200)
GO:0033674,0.7231946,1.150907,0.7394928,LRRK2;ROR2,Positive Regulation Of Kinase Activity (GO:0033674)
GO:0033993,0.7298088,1.128643,0.7036936,RXRA;ESR1,Response To Lipid (GO:0033993)
GO:0000723,0.7298088,1.128643,0.7036936,BLM;ATR,Telomere Maintenance (GO:0000723)
GO:0051983,0.7298088,1.333952,0.826811,CDC6,Regulation Of Chromosome Segregation (GO:0051983)
GO:0009063,0.7298088,1.333952,0.826811,BCKDHB,Amino Acid Catabolic Process (GO:0009063)
GO:0051881,0.7298088,1.333952,0.826811,LRRK2,Regulation Of Mitochondrial Membrane Potential (GO:0051881)
GO:0060393,0.7298088,1.333952,0.826811,SNX25,Regulation Of Pathway-Restricted SMAD Protein Phosphorylation (GO:0060393)
GO:0032271,0.7298088,1.333952,0.826811,MEGF9,Regulation Of Protein Polymerization (GO:0032271)
GO:0046425,0.7298088,1.333952,0.826811,OCIAD2,Regulation Of Receptor Signaling Pathway Via JAK-STAT (GO:0046425)
GO:0006821,0.7298088,1.333952,0.826811,CLCN6,Chloride Transport (GO:0006821)
GO:0007423,0.7298088,1.333952,0.826811,SIX4,Sensory Organ Development (GO:0007423)
GO:0002040,0.7298088,1.333952,0.826811,E2F7,Sprouting Angiogenesis (GO:0002040)
GO:0010823,0.7298088,1.333952,0.826811,OMA1,Negative Regulation Of Mitochondrion Organization (GO:0010823)
GO:0008654,0.7298088,1.333952,0.826811,LPCAT1,Phospholipid Biosynthetic Process (GO:0008654)
GO:0031648,0.7298088,1.333952,0.826811,HTT,Protein Destabilization (GO:0031648)
GO:0032527,0.7298088,1.333952,0.826811,SELENOS,Protein Exit From Endoplasmic Reticulum (GO:0032527)
GO:0010646,0.7298088,1.333952,0.826811,LTBP1,Regulation Of Cell Communication (GO:0010646)
GO:0043393,0.7364238,1.060447,0.6468234,STING1;LRRK2;STYX,Regulation Of Protein Binding (GO:0043393)
GO:0006486,0.7399036,1.047701,0.6239677,PLOD2;SLC39A8;ST3GAL6,Protein Glycosylation (GO:0006486)
GO:1902275,0.7399036,1.275806,0.755057,SETD5,Regulation Of Chromatin Organization (GO:1902275)
GO:0030330,0.7399036,1.275806,0.755057,E2F7,"DNA Damage Response, Signal Transduction By P53 Class Mediator (GO:0030330)"
GO:0048488,0.7399036,1.275806,0.755057,DNM1,Synaptic Vesicle Endocytosis (GO:0048488)
GO:0006641,0.7399036,1.275806,0.755057,LPIN1,Triglyceride Metabolic Process (GO:0006641)
GO:0046785,0.7399036,1.275806,0.755057,TRPV4,Microtubule Polymerization (GO:0046785)
GO:0006820,0.7399036,1.275806,0.755057,CLCN6,Monoatomic Anion Transport (GO:0006820)
GO:0010812,0.7399036,1.275806,0.755057,FBLN1,Negative Regulation Of Cell-Substrate Adhesion (GO:0010812)
GO:0001764,0.7399036,1.275806,0.755057,CELSR1,Neuron Migration (GO:0001764)
GO:1901617,0.7399036,1.275806,0.755057,OSBPL6,Organic Hydroxy Compound Biosynthetic Process (GO:1901617)
GO:0045089,0.7399036,1.275806,0.755057,STING1,Positive Regulation Of Innate Immune Response (GO:0045089)
GO:1902745,0.7399036,1.275806,0.755057,FSCN1,Positive Regulation Of Lamellipodium Organization (GO:1902745)
GO:0045663,0.7399036,1.275806,0.755057,IGFBP3,Positive Regulation Of Myoblast Differentiation (GO:0045663)
GO:0010638,0.7399036,1.275806,0.755057,PLXNA3,Positive Regulation Of Organelle Organization (GO:0010638)
GO:0006479,0.7399036,1.275806,0.755057,METTL21A,Protein Methylation (GO:0006479)
GO:0006622,0.7399036,1.275806,0.755057,ATG14,Protein Targeting To Lysosome (GO:0006622)
GO:0006874,0.742674,1.086588,0.6381076,TRPV4;SELENOK,Intracellular Calcium Ion Homeostasis (GO:0006874)
GO:0043933,0.7463318,1.035254,0.6020137,WIPF1;CAPG;SLC25A46,Protein-Containing Complex Organization (GO:0043933)
GO:0010569,0.7496683,1.066708,0.6080487,FANCB;SPIDR,Regulation Of Double-Strand Break Repair Via Homologous Recombination (GO:0010569)
GO:0006259,0.7496683,0.9852136,0.558369,FAM111A;NEIL3;BLM;PARP2;FSCN1;TENT4A;ATR;UNG,DNA Metabolic Process (GO:0006259)
GO:0032386,0.7496683,1.222506,0.6913052,LRRK2,Regulation Of Intracellular Transport (GO:0032386)
GO:0008589,0.7496683,1.222506,0.6913052,EVC,Regulation Of Smoothened Signaling Pathway (GO:0008589)
GO:0001837,0.7496683,1.222506,0.6913052,CUL7,Epithelial To Mesenchymal Transition (GO:0001837)
GO:0071173,0.7496683,1.222506,0.6913052,HASPIN,Spindle Assembly Checkpoint Signaling (GO:0071173)
GO:0009247,0.7496683,1.222506,0.6913052,ST3GAL6,Glycolipid Biosynthetic Process (GO:0009247)
GO:0007094,0.7496683,1.222506,0.6913052,HASPIN,Mitotic Spindle Assembly Checkpoint Signaling (GO:0007094)
GO:0071174,0.7496683,1.222506,0.6913052,HASPIN,Mitotic Spindle Checkpoint Signaling (GO:0071174)
GO:0032873,0.7496683,1.222506,0.6913052,MYC,Negative Regulation Of Stress-Activated MAPK Cascade (GO:0032873)
GO:0045071,0.7496683,1.222506,0.6913052,FAM111A,Negative Regulation Of Viral Genome Replication (GO:0045071)
GO:1900087,0.7496683,1.222506,0.6913052,CDC6,Positive Regulation Of G1/S Transition Of Mitotic Cell Cycle (GO:1900087)
GO:0032732,0.7496683,1.222506,0.6913052,PANX1,Positive Regulation Of Interleukin-1 Production (GO:0032732)
GO:2000379,0.7496683,1.222506,0.6913052,CBR1,Positive Regulation Of Reactive Oxygen Species Metabolic Process (GO:2000379)
GO:0051347,0.7622548,0.9996108,0.5411605,DSCC1;MYC;ROR2,Positive Regulation Of Transferase Activity (GO:0051347)
GO:0046034,0.7622548,1.173469,0.6344349,AK4,ATP Metabolic Process (GO:0046034)
GO:0010631,0.7622548,1.173469,0.6344349,ZEB2,Epithelial Cell Migration (GO:0010631)
GO:0006694,0.7622548,1.173469,0.6344349,OSBPL6,Steroid Biosynthetic Process (GO:0006694)
GO:0008202,0.7622548,1.173469,0.6344349,CBR1,Steroid Metabolic Process (GO:0008202)
GO:0007095,0.7622548,1.173469,0.6344349,BLM,Mitotic G2 DNA Damage Checkpoint Signaling (GO:0007095)
GO:0034661,0.7622548,1.173469,0.6344349,TUT4,ncRNA Catabolic Process (GO:0034661)
GO:0045841,0.7622548,1.173469,0.6344349,HASPIN,Negative Regulation Of Mitotic Metaphase/Anaphase Transition (GO:0045841)
GO:0032728,0.7622548,1.173469,0.6344349,STING1,Positive Regulation Of Interferon-Beta Production (GO:0032728)
GO:2001244,0.7622548,1.173469,0.6344349,MYC,Positive Regulation Of Intrinsic Apoptotic Signaling Pathway (GO:2001244)
GO:0031348,0.7636432,1.02904,0.5528008,SELENOS;SLC39A8,Negative Regulation Of Defense Response (GO:0031348)
GO:0090101,0.7636432,1.02904,0.5528008,CD109;SNX25,Negative Regulation Of Transmembrane Receptor Protein Serine/Threonine Kinase Signaling Pathway (GO:0090101)
GO:0065003,0.767746,0.967407,0.5137209,BLM;STING1;WIPF1;LRRK2;CAPG;OMA1;SLC25A46,Protein-Containing Complex Assembly (GO:0065003)
GO:0032392,0.7690528,1.128205,0.5835153,BLM,DNA Geometric Change (GO:0032392)
GO:0048145,0.7690528,1.128205,0.5835153,MYC,Regulation Of Fibroblast Proliferation (GO:0048145)
GO:0035304,0.7690528,1.128205,0.5835153,HTT,Regulation Of Protein Dephosphorylation (GO:0035304)
GO:0061041,0.7690528,1.128205,0.5835153,CD109,Regulation Of Wound Healing (GO:0061041)
GO:0002183,0.7690528,1.128205,0.5835153,MCTS2,Cytoplasmic Translational Initiation (GO:0002183)
GO:0007605,0.7690528,1.128205,0.5835153,MYO3B,Sensory Perception Of Sound (GO:0007605)
GO:0036465,0.7690528,1.128205,0.5835153,DNM1,Synaptic Vesicle Recycling (GO:0036465)
GO:0033209,0.7690528,1.128205,0.5835153,TNFRSF1B,Tumor Necrosis Factor-Mediated Signaling Pathway (GO:0033209)
GO:0010951,0.7690528,1.128205,0.5835153,TIMP1,Negative Regulation Of Endopeptidase Activity (GO:0010951)
GO:0032435,0.7690528,1.128205,0.5835153,STYX,Negative Regulation Of Proteasomal Ubiquitin-Dependent Protein Catabolic Process (GO:0032435)
GO:0051051,0.7690528,1.128205,0.5835153,SCAMP5,Negative Regulation Of Transport (GO:0051051)
GO:0051973,0.7690528,1.128205,0.5835153,MYC,Positive Regulation Of Telomerase Activity (GO:0051973)
GO:0032212,0.7690528,1.128205,0.5835153,ATR,Positive Regulation Of Telomere Maintenance Via Telomerase (GO:0032212)
GO:0051050,0.7690528,1.128205,0.5835153,RXRA,Positive Regulation Of Transport (GO:0051050)
GO:0043543,0.7690528,1.128205,0.5835153,SELENOK,Protein Acylation (GO:0043543)
GO:0051345,0.7692201,0.9771689,0.5044012,DOCK6;CCL2;MAPK12,Positive Regulation Of Hydrolase Activity (GO:0051345)
GO:0006897,0.7732413,0.9608473,0.4885235,LRRK2;OCIAD2;DNM1;PDLIM7,Endocytosis (GO:0006897)
GO:0001817,0.7732413,0.9939261,0.5033561,SCAMP5;TNFRSF1B,Regulation Of Cytokine Production (GO:0001817)
GO:0048699,0.7732413,0.9939261,0.5033561,SIX4;CELSR1,Generation Of Neurons (GO:0048699)
GO:0031331,0.7732413,0.9663179,0.4870649,LRRK2;TNFRSF1B;DAGLB,Positive Regulation Of Cellular Catabolic Process (GO:0031331)
GO:0001819,0.7732413,0.9529238,0.474617,SCAMP5;STING1;IL17RA;APPL1,Positive Regulation Of Cytokine Production (GO:0001819)
GO:0006508,0.7732413,0.9529238,0.474617,THBD;FAM111A;CUL7;HTRA1,Proteolysis (GO:0006508)
GO:1902099,0.7732413,1.086294,0.5377681,CDC6,Regulation Of Metaphase/Anaphase Transition Of Cell Cycle (GO:1902099)
GO:0034605,0.7732413,1.086294,0.5377681,TRPV4,Cellular Response To Heat (GO:0034605)
GO:0051049,0.7732413,1.086294,0.5377681,LRRK2,Regulation Of Transport (GO:0051049)
GO:0050954,0.7732413,1.086294,0.5377681,MYO3B,Sensory Perception Of Mechanical Stimulus (GO:0050954)
GO:0051403,0.7732413,1.086294,0.5377681,LRRK2,Stress-Activated MAPK Cascade (GO:0051403)
GO:0030518,0.7732413,1.086294,0.5377681,ESR1,Intracellular Steroid Hormone Receptor Signaling Pathway (GO:0030518)
GO:0080171,0.7732413,1.086294,0.5377681,LRRK2,Lytic Vacuole Organization (GO:0080171)
GO:0035196,0.7732413,1.086294,0.5377681,TUT4,miRNA Processing (GO:0035196)
GO:0051851,0.7732413,1.086294,0.5377681,JUN,Modulation By Host Of Symbiont Process (GO:0051851)
GO:0048585,0.7732413,1.086294,0.5377681,IGFBP3,Negative Regulation Of Response To Stimulus (GO:0048585)
GO:0002221,0.7732413,1.086294,0.5377681,STING1,Pattern Recognition Receptor Signaling Pathway (GO:0002221)
GO:0120039,0.7732413,1.086294,0.5377681,LRRK2,Plasma Membrane Bounded Cell Projection Morphogenesis (GO:0120039)
